No.     Time           Source                Destination           Protocol Length Info
     28 5.403149000    172.20.1.39           81.88.48.78           HTTP     139    POST /it/area-riservata/access/signin HTTP/1.1  (application/x-www-form-urlencoded)

Frame 28: 139 bytes on wire (1112 bits), 139 bytes captured (1112 bits) on interface 0
Ethernet II, Src: Hewlett-_73:6c:06 (00:18:71:73:6c:06), Dst: Sonicwal_30:0e:30 (c0:ea:e4:30:0e:30)
Internet Protocol Version 4, Src: 172.20.1.39 (172.20.1.39), Dst: 81.88.48.78 (81.88.48.78)
Transmission Control Protocol, Src Port: 50947 (50947), Dst Port: http (80), Seq: 323, Ack: 1, Len: 73
[2 Reassembled TCP Segments (395 bytes): #27(322), #28(73)]
Hypertext Transfer Protocol
    POST /it/area-riservata/access/signin HTTP/1.1\r\n
    Content-Type: application/x-www-form-urlencoded\r\n
    charset: utf-8\r\n
    Cache-Control: no-cache\r\n
    Pragma: no-cache\r\n
    User-Agent: Java/1.7.0_40\r\n
    Host: www.scuolascilimone.com\r\n
    Accept: text/html, image/gif, image/jpeg, *; q=.2, */*; q=.2\r\n
    Connection: keep-alive\r\n
    Content-Length: 73\r\n
    \r\n
    [Full request URI: http://www.scuolascilimone.com/it/area-riservata/access/signin]
    [HTTP request 1/1]
    [Response in frame: 35]
Line-based text data: application/x-www-form-urlencoded
    task=signin&accion=signin&textBoxUsername=larapic&textBoxPassword=gualano

Frame 204: 879 bytes on wire (7032 bits), 879 bytes captured (7032 bits) on interface 0
Ethernet II, Src: Hewlett-_73:6c:06 (00:18:71:73:6c:06), Dst: Sonicwal_30:0e:30 (c0:ea:e4:30:0e:30)
Internet Protocol Version 4, Src: 172.20.1.39 (172.20.1.39), Dst: 81.88.48.78 (81.88.48.78)
Transmission Control Protocol, Src Port: 50926 (50926), Dst Port: http (80), Seq: 1, Ack: 1, Len: 813
Hypertext Transfer Protocol
    POST /en/admin/access/signin HTTP/1.1\r\n
    Host: www.scuolascilimone.com\r\n
    User-Agent: Mozilla/5.0 (X11; Linux i686; rv:24.0) Gecko/20100101 Firefox/24.0\r\n
    Accept: text/html,application/xhtml+xml,application/xml;q=0.9,*/*;q=0.8\r\n
    Accept-Language: en-US,en;q=0.5\r\n
    Accept-Encoding: gzip, deflate\r\n
    Referer: http://www.scuolascilimone.com/en/admin/access/signin\r\n
    [truncated] Cookie: __utma=69690514.2111009017.1380039495.1381478424.1381818725.7; __utmz=69690514.1380039495.1.1.utmcsr=(direct)|utmccn=(direct)|utmcmd=(none); b122d22c08a7d2502bd427ee4a4182a9=laumaltsssdnq81e1oksmkqjv4; __utmc=69690514; 
    Connection: keep-alive\r\n
    Content-Type: application/x-www-form-urlencoded\r\n
    Content-Length: 87\r\n
    \r\n
    [Full request URI: http://www.scuolascilimone.com/en/admin/access/signin]
    [HTTP request 1/3]
    [Response in frame: 294]
    [Next request in frame: 296]
Line-based text data: application/x-www-form-urlencoded
    task=signin&accion=signin&textBoxUsername=larapic&textBoxPassword=gualano&buttonSubmit=


