No.     Time           Source                Destination           Protocol Length Info
     50 5.287480000    172.20.1.39           81.88.48.78           HTTP     139    POST /en/admin/access/signin HTTP/1.1  (application/x-www-form-urlencoded)

Frame 50: 139 bytes on wire (1112 bits), 139 bytes captured (1112 bits) on interface 0
Ethernet II, Src: Hewlett-_73:6c:06 (00:18:71:73:6c:06), Dst: Sonicwal_30:0e:30 (c0:ea:e4:30:0e:30)
Internet Protocol Version 4, Src: 172.20.1.39 (172.20.1.39), Dst: 81.88.48.78 (81.88.48.78)
Transmission Control Protocol, Src Port: 50981 (50981), Dst Port: http (80), Seq: 314, Ack: 1, Len: 73
[2 Reassembled TCP Segments (386 bytes): #49(313), #50(73)]
Hypertext Transfer Protocol
    POST /en/admin/access/signin HTTP/1.1\r\n
    Content-Type: application/x-www-form-urlencoded\r\n
    charset: utf-8\r\n
    Cache-Control: no-cache\r\n
    Pragma: no-cache\r\n
    User-Agent: Java/1.7.0_40\r\n
    Host: www.scuolascilimone.com\r\n
    Accept: text/html, image/gif, image/jpeg, *; q=.2, */*; q=.2\r\n
    Connection: keep-alive\r\n
    Content-Length: 73\r\n
    \r\n
    [Full request URI: http://www.scuolascilimone.com/en/admin/access/signin]
    [HTTP request 1/1]
    [Response in frame: 55]
Line-based text data: application/x-www-form-urlencoded
    task=signin&accion=signin&textBoxUsername=larapic&textBoxPassword=gualano

No.     Time           Source                Destination           Protocol Length Info
     55 6.039668000    81.88.48.78           172.20.1.39           HTTP     736    HTTP/1.1 303 See other 

Frame 55: 736 bytes on wire (5888 bits), 736 bytes captured (5888 bits) on interface 0
Ethernet II, Src: Sonicwal_30:0e:30 (c0:ea:e4:30:0e:30), Dst: Hewlett-_73:6c:06 (00:18:71:73:6c:06)
Internet Protocol Version 4, Src: 81.88.48.78 (81.88.48.78), Dst: 172.20.1.39 (172.20.1.39)
Transmission Control Protocol, Src Port: http (80), Dst Port: 50981 (50981), Seq: 1, Ack: 387, Len: 670
Hypertext Transfer Protocol
    HTTP/1.1 303 See other\r\n
    Date: Tue, 15 Oct 2013 06:48:55 GMT\r\n
    Server: Apache/2.2.14 (Unix)\r\n
    X-Powered-By: PHP/5.2.6-1+lenny9\r\n
    P3P: CP="NOI ADM DEV PSAi COM NAV OUR OTRo STP IND DEM"\r\n
    Location: http://www.scuolascilimone.com/en/admin/news\r\n
    Content-Length: 0\r\n
    Content-Type: text/html\r\n
    Content-Language: it\r\n
    Set-Cookie: b122d22c08a7d2502bd427ee4a4182a9=kearh6uhghhmh9krioln1sh6l7; path=/\r\n
    Set-Cookie: lang=deleted; expires=Mon, 15-Oct-2012 06:48:55 GMT; path=/\r\n
    Set-Cookie: jfcookie=deleted; expires=Mon, 15-Oct-2012 06:48:55 GMT; path=/\r\n
    Set-Cookie: jfcookie[lang]=en; expires=Wed, 16-Oct-2013 06:48:56 GMT; path=/\r\n
    Keep-Alive: timeout=2, max=90\r\n
    Connection: Keep-Alive\r\n
    \r\n
    [HTTP response 1/1]
    [Time since request: 0.752188000 seconds]
    [Request in frame: 50]

No.     Time           Source                Destination           Protocol Length Info
     63 6.052382000    172.20.1.39           81.88.48.78           HTTP     284    GET /en/admin/news HTTP/1.1 

Frame 63: 284 bytes on wire (2272 bits), 284 bytes captured (2272 bits) on interface 0
Ethernet II, Src: Hewlett-_73:6c:06 (00:18:71:73:6c:06), Dst: Sonicwal_30:0e:30 (c0:ea:e4:30:0e:30)
Internet Protocol Version 4, Src: 172.20.1.39 (172.20.1.39), Dst: 81.88.48.78 (81.88.48.78)
Transmission Control Protocol, Src Port: 50982 (50982), Dst Port: http (80), Seq: 1, Ack: 1, Len: 218
Hypertext Transfer Protocol
    GET /en/admin/news HTTP/1.1\r\n
    Cache-Control: no-cache\r\n
    Pragma: no-cache\r\n
    User-Agent: Java/1.7.0_40\r\n
    Host: www.scuolascilimone.com\r\n
    Accept: text/html, image/gif, image/jpeg, *; q=.2, */*; q=.2\r\n
    Connection: keep-alive\r\n
    \r\n
    [Full request URI: http://www.scuolascilimone.com/en/admin/news]
    [HTTP request 1/1]
    [Response in frame: 65]

No.     Time           Source                Destination           Protocol Length Info
     65 7.096853000    81.88.48.78           172.20.1.39           HTTP     745    HTTP/1.1 303 See other 

Frame 65: 745 bytes on wire (5960 bits), 745 bytes captured (5960 bits) on interface 0
Ethernet II, Src: Sonicwal_30:0e:30 (c0:ea:e4:30:0e:30), Dst: Hewlett-_73:6c:06 (00:18:71:73:6c:06)
Internet Protocol Version 4, Src: 81.88.48.78 (81.88.48.78), Dst: 172.20.1.39 (172.20.1.39)
Transmission Control Protocol, Src Port: http (80), Dst Port: 50982 (50982), Seq: 1, Ack: 219, Len: 679
Hypertext Transfer Protocol
    HTTP/1.1 303 See other\r\n
    Date: Tue, 15 Oct 2013 06:48:56 GMT\r\n
    Server: Apache/2.2.14 (Unix)\r\n
    X-Powered-By: PHP/5.2.6-1+lenny9\r\n
    P3P: CP="NOI ADM DEV PSAi COM NAV OUR OTRo STP IND DEM"\r\n
    Location: http://www.scuolascilimone.com/en/admin/access/signin\r\n
    Content-Length: 0\r\n
    Content-Type: text/html\r\n
    Content-Language: it\r\n
    Set-Cookie: b122d22c08a7d2502bd427ee4a4182a9=ipvbvkt5t28lh9cvbe3j6erf11; path=/\r\n
    Set-Cookie: lang=deleted; expires=Mon, 15-Oct-2012 06:48:56 GMT; path=/\r\n
    Set-Cookie: jfcookie=deleted; expires=Mon, 15-Oct-2012 06:48:56 GMT; path=/\r\n
    Set-Cookie: jfcookie[lang]=en; expires=Wed, 16-Oct-2013 06:48:57 GMT; path=/\r\n
    Keep-Alive: timeout=2, max=90\r\n
    Connection: Keep-Alive\r\n
    \r\n
    [HTTP response 1/1]
    [Time since request: 1.044471000 seconds]
    [Request in frame: 63]

No.     Time           Source                Destination           Protocol Length Info
     73 7.109119000    172.20.1.39           81.88.48.78           HTTP     293    GET /en/admin/access/signin HTTP/1.1 

Frame 73: 293 bytes on wire (2344 bits), 293 bytes captured (2344 bits) on interface 0
Ethernet II, Src: Hewlett-_73:6c:06 (00:18:71:73:6c:06), Dst: Sonicwal_30:0e:30 (c0:ea:e4:30:0e:30)
Internet Protocol Version 4, Src: 172.20.1.39 (172.20.1.39), Dst: 81.88.48.78 (81.88.48.78)
Transmission Control Protocol, Src Port: 50983 (50983), Dst Port: http (80), Seq: 1, Ack: 1, Len: 227
Hypertext Transfer Protocol
    GET /en/admin/access/signin HTTP/1.1\r\n
    Cache-Control: no-cache\r\n
    Pragma: no-cache\r\n
    User-Agent: Java/1.7.0_40\r\n
    Host: www.scuolascilimone.com\r\n
    Accept: text/html, image/gif, image/jpeg, *; q=.2, */*; q=.2\r\n
    Connection: keep-alive\r\n
    \r\n
    [Full request URI: http://www.scuolascilimone.com/en/admin/access/signin]
    [HTTP request 1/1]
